{
  "gates": [
    {
      "evidence": "manifests/plugin-coverage.json reports all canonical primitives routed.",
      "name": "canonical-plugin-coverage",
      "nextAction": "Keep plugin coverage generated and checked before source replacement.",
      "status": "PASS",
      "type": "SOURCE_TURNOFF_GATE"
    },
    {
      "evidence": "0 canonical primitives still need audit decisions.",
      "name": "review-completeness",
      "nextAction": "Close review-completeness gaps before treating the source graph as fully reviewed.",
      "status": "PASS",
      "type": "SOURCE_TURNOFF_GATE"
    },
    {
      "evidence": "0 source-review entries remain open.",
      "name": "source-review-decisions",
      "nextAction": "Keep every generated name-review group synchronized with source-review decisions.",
      "status": "PASS",
      "type": "SOURCE_TURNOFF_GATE"
    },
    {
      "evidence": "0 digest-review entries remain open.",
      "name": "digest-review-decisions",
      "nextAction": "Keep every generated duplicate-content group synchronized with digest-review decisions.",
      "status": "PASS",
      "type": "SOURCE_TURNOFF_GATE"
    },
    {
      "evidence": "13 proposed replacements and 0 approved replacements are recorded.",
      "name": "cleanup-ledger-approval",
      "nextAction": "Treat PROPOSED entries as review records only; execute nothing until explicit approval changes status.",
      "status": "REVIEW_REQUIRED",
      "type": "SOURCE_TURNOFF_GATE"
    },
    {
      "evidence": "28 generated review groups are intentionally retained in external owners.",
      "name": "external-retention",
      "nextAction": "Do not replace RETAIN_EXTERNAL groups from this repository unless a new canonical promotion is reviewed.",
      "status": "PASS",
      "type": "SOURCE_TURNOFF_GATE"
    },
    {
      "evidence": "0 inactive runtime link or marketplace import plans still require explicit approval.",
      "name": "runtime-activation-approval",
      "nextAction": "Use runtime-links.json as activation planning evidence, not as permission to write runtime paths.",
      "status": "PASS",
      "type": "SOURCE_TURNOFF_GATE"
    }
  ],
  "generatedFrom": {
    "cleanupLedger": "manifests/cleanup-ledger.json",
    "digestReviewDecisions": "manifests/digest-review-decisions.json",
    "pluginCoverage": "manifests/plugin-coverage.json",
    "reviewCompleteness": "manifests/review-completeness.json",
    "runtimeLinks": "manifests/runtime-links.json",
    "sourceReviewDecisions": "manifests/source-review-decisions.json",
    "type": "SOURCE_TURNOFF_READINESS_INPUTS"
  },
  "proposedReplacements": [
    {
      "canonicalPath": "skills/agent-profile-authoring",
      "decision": "REPLACE_WITH_SYMLINK",
      "reviewEvidenceSha256": "sha256:f7789cf6996c66a8ae0d09857c127c597bbeabaa5805be3d90b481374726c4f9",
      "sourcePath": "agent-profile-authoring",
      "sourceRoot": "apollo-skills",
      "status": "PROPOSED",
      "type": "SOURCE_REPLACEMENT_PROPOSAL"
    },
    {
      "canonicalPath": "skills/github-ci-operations",
      "decision": "REPLACE_WITH_SYMLINK",
      "reviewEvidenceSha256": "sha256:88fc2c00d20207399b75db33be2b67e7ae8e4ec717511c008ac0825909a33603",
      "sourcePath": "github-ci-operations",
      "sourceRoot": "apollo-skills",
      "status": "PROPOSED",
      "type": "SOURCE_REPLACEMENT_PROPOSAL"
    },
    {
      "canonicalPath": "skills/hook-primitive-authoring",
      "decision": "REPLACE_WITH_SYMLINK",
      "reviewEvidenceSha256": "sha256:e22bd11538027c86a30c78e5cf1c342b5523dfc976ea3021caf101787963ce71",
      "sourcePath": "hook-primitive-authoring",
      "sourceRoot": "apollo-skills",
      "status": "PROPOSED",
      "type": "SOURCE_REPLACEMENT_PROPOSAL"
    },
    {
      "canonicalPath": "skills/local-repository-navigation",
      "decision": "REPLACE_WITH_SYMLINK",
      "reviewEvidenceSha256": "sha256:ac83ea1916cdcab2c49e2ee63a8bca81c0fbafcf56db22c5bc0202d8f0b276d8",
      "sourcePath": "local-repository-navigation",
      "sourceRoot": "apollo-skills",
      "status": "PROPOSED",
      "type": "SOURCE_REPLACEMENT_PROPOSAL"
    },
    {
      "canonicalPath": "skills/plugin-composition-authoring",
      "decision": "REPLACE_WITH_SYMLINK",
      "reviewEvidenceSha256": "sha256:cb665208e75877050d2c2fbb6ac4d08deb0241afbd3c254497c28becc0b886f6",
      "sourcePath": "plugin-composition-authoring",
      "sourceRoot": "apollo-skills",
      "status": "PROPOSED",
      "type": "SOURCE_REPLACEMENT_PROPOSAL"
    },
    {
      "canonicalPath": "skills/primitive-quality-audit",
      "decision": "REPLACE_WITH_SYMLINK",
      "reviewEvidenceSha256": "sha256:4ee7ae20c6010911f68c103495ddf8a93080b378cd2330797c35ca5214ee0a97",
      "sourcePath": "primitive-quality-audit",
      "sourceRoot": "apollo-skills",
      "status": "PROPOSED",
      "type": "SOURCE_REPLACEMENT_PROPOSAL"
    },
    {
      "canonicalPath": "skills/primitive-routing-evaluation",
      "decision": "REPLACE_WITH_SYMLINK",
      "reviewEvidenceSha256": "sha256:c7a9697567dfe4442abe481162aae4f5724b108db671b41586bbc38d30f62e7a",
      "sourcePath": "primitive-routing-evaluation",
      "sourceRoot": "apollo-skills",
      "status": "PROPOSED",
      "type": "SOURCE_REPLACEMENT_PROPOSAL"
    },
    {
      "canonicalPath": "skills/repository-signature-indexing",
      "decision": "REPLACE_WITH_SYMLINK",
      "reviewEvidenceSha256": "sha256:8494dd6b59ead010e7f071cb22d5c85d818842801dcc7494f7e443157db83a73",
      "sourcePath": "repository-signature-indexing",
      "sourceRoot": "apollo-skills",
      "status": "PROPOSED",
      "type": "SOURCE_REPLACEMENT_PROPOSAL"
    },
    {
      "canonicalPath": "skills/runtime-linking",
      "decision": "REPLACE_WITH_SYMLINK",
      "reviewEvidenceSha256": "sha256:58e05aee752728295f29ee6327d4101634b15847818a967c53035f0a28e1ead4",
      "sourcePath": "runtime-linking",
      "sourceRoot": "apollo-skills",
      "status": "PROPOSED",
      "type": "SOURCE_REPLACEMENT_PROPOSAL"
    },
    {
      "canonicalPath": "skills/shell-script-safety",
      "decision": "REPLACE_WITH_SYMLINK",
      "reviewEvidenceSha256": "sha256:fee78b7f191c58520722e4ecc99cdd31ed9b668f5c4c4dba68a1993d8c361a1f",
      "sourcePath": "shell-script-safety",
      "sourceRoot": "apollo-skills",
      "status": "PROPOSED",
      "type": "SOURCE_REPLACEMENT_PROPOSAL"
    },
    {
      "canonicalPath": "skills/site-docs-authoring",
      "decision": "REPLACE_WITH_SYMLINK",
      "reviewEvidenceSha256": "sha256:3d4683e1792a3ec3b33809425e80f0af61c1be1a49ce789423612b0aeeeffb00",
      "sourcePath": "site-docs-authoring",
      "sourceRoot": "apollo-skills",
      "status": "PROPOSED",
      "type": "SOURCE_REPLACEMENT_PROPOSAL"
    },
    {
      "canonicalPath": "skills/skill-primitive-authoring",
      "decision": "REPLACE_WITH_SYMLINK",
      "reviewEvidenceSha256": "sha256:acc08f67edeac53ff96d28117913c11e55abc3a144724077bb6e8ba376acdee7",
      "sourcePath": "skill-primitive-authoring",
      "sourceRoot": "apollo-skills",
      "status": "PROPOSED",
      "type": "SOURCE_REPLACEMENT_PROPOSAL"
    },
    {
      "canonicalPath": "skills/source-graph-consolidation",
      "decision": "REPLACE_WITH_SYMLINK",
      "reviewEvidenceSha256": "sha256:86dbd7f4878f531348acb3daf82db00fc25c1cf797d0335b77fc44e14c726f7e",
      "sourcePath": "source-graph-consolidation",
      "sourceRoot": "apollo-skills",
      "status": "PROPOSED",
      "type": "SOURCE_REPLACEMENT_PROPOSAL"
    }
  ],
  "schemaVersion": 1,
  "summary": {
    "allCanonicalRouted": true,
    "approvedReplacements": 0,
    "canMutateRuntimeWithoutApproval": false,
    "digestReviewOpen": 0,
    "executedCleanupEntries": 33,
    "nextAction": "Review proposed cleanup-ledger replacements; do not mutate runtime paths until explicitly approved.",
    "proposedReplacements": 13,
    "readinessStatus": "REVIEW_READY",
    "retainedExternalGroups": 28,
    "reviewCompletenessOpen": 0,
    "runtimeLinksRequiringApproval": 0,
    "sourceReviewOpen": 0,
    "type": "SOURCE_TURNOFF_READINESS_SUMMARY"
  },
  "type": "SOURCE_TURNOFF_READINESS_REPORT"
}
